{
  "schema_version": "1.0.0",
  "context": {
    "workspace_id": "ws-demo",
    "session_id": "session-demo",
    "run_id": "run-demo",
    "document_id": "fs-demo",
    "base_document_version": "dv-7",
    "context_snapshot_id": "ctx-7",
    "template_id": "traditional-abap-five",
    "template_version": "1.0.0"
  },
  "id": "dv-7",
  "revision": 7,
  "version_number": 0,
  "title": "供应商未清项批量处理讨论稿",
  "content_hash": "fixture-hash-dv7",
  "lifecycle": "draft",
  "sections": [
    {
      "id": "section-1",
      "template_slot": "overview",
      "title": "开发概述与范围",
      "blocks": [
        {
          "id": "block-1",
          "kind": "paragraph",
          "text": "讨论稿：批量处理规则待确认，尚未验证 SAP 执行对象。",
          "columns": [],
          "rows": [],
          "classification": "pending",
          "requirement_ids": [
            "req-1"
          ],
          "rule_ids": [
            "rule-1"
          ],
          "decision_ids": [],
          "evidence_refs": [
            {
              "evidence_id": "ev-message-1",
              "locator": "message:msg-1#chars=0-20",
              "conclusion": "用户要求供应商未清项批量处理"
            }
          ]
        }
      ]
    }
  ],
  "tests": [
    {
      "id": "test-1",
      "title": "跨币种候选隔离",
      "preconditions": [
        "同供应商存在 CNY 与 USD 项目"
      ],
      "steps": [
        "生成匹配候选"
      ],
      "expected": [
        "不跨币种匹配或合计"
      ],
      "requirement_ids": [
        "req-1"
      ],
      "rule_ids": [
        "rule-1"
      ],
      "section_ids": [
        "section-1"
      ],
      "evidence_refs": []
    }
  ],
  "requirement_refs": [
    "req-1"
  ],
  "rule_refs": [
    "rule-1"
  ],
  "decision_refs": [],
  "open_issue_ids": [
    "issue-1"
  ],
  "verifications": [
    {
      "id": "verify-1",
      "target": {
        "system_id": "target-unselected",
        "client": "unknown",
        "release": "unknown"
      },
      "claim": "目标系统支持所需清账与事务控制",
      "object_name": null,
      "scope": "签名、模拟、锁定、提交语义",
      "status": "unverified",
      "evidence_ids": [],
      "checked_at": null,
      "valid_until": null,
      "limitations": [
        "目标系统尚未选择"
      ],
      "applicability": "pending",
      "applicability_reason": "缺少技术证据"
    }
  ],
  "confirmation_refs": [],
  "review_refs": [],
  "approval_refs": [],
  "evidence_manifest_ids": [
    "ev-message-1"
  ],
  "created_at": "2026-10-03T08:00:00Z",
  "created_by": "user-demo"
}
